{
  "schemaVersion": "1.0.0",
  "kind": "jovra.fixture.scoring",
  "id": "S60-no-let-receiver-not-ready",
  "title": "No-Let removes only the net-cord let (App VI, Rule 22.1.a); a receiver-not-ready let (22.1.b) is still a let, so a let serve in a No-Let format is not a conflict",
  "covers": ["§3 No-Let format", "§3 Rule 22"],
  "input": {
    "format": {
      "presetId": "fast4",
      "setsToWin": 2,
      "gameScoring": "noAd",
      "set": {
        "kind": "tiebreakSet",
        "games": 4,
        "tiebreakAt": 3,
        "tiebreak": {"points": 5, "suddenDeathAt": 4, "endChange": "after4"}
      },
      "finalSet": {
        "kind": "tiebreakSet",
        "games": 4,
        "tiebreakAt": 3,
        "tiebreak": {"points": 5, "suddenDeathAt": 4, "endChange": "after4"}
      },
      "lets": "noLet",
      "ruleStatus": "unverified"
    },
    "players": [
      {"id": "jon", "displayName": "Jon", "handedness": "right", "backhand": "twoHanded", "isSelf": true},
      {"id": "alex", "displayName": "Alex", "handedness": "left", "backhand": "oneHanded", "isSelf": false}
    ],
    "sides": {"A": ["jon"], "B": ["alex"]},
    "toss": {"firstServer": "jon", "startingEnds": {"A": "near", "B": "far"}},
    "log": [
      {"id": "e001", "seq": 1, "type": "point", "reviewed": {"winner": "A", "endType": "ace", "serves": [{"result": "let"}, {"result": "in"}], "strokeCount": 1, "provenance": "manual", "source": "user"}}
    ]
  },
  "assertions": [
    {"checkpoint": 0, "path": "fold.conflicts", "equals": []},
    {"checkpoint": 0, "path": "fold.points[0].serveNumber", "equals": 1},
    {
      "checkpoint": 0,
      "path": "stats.sides.A.firstServeIn",
      "equals": {"n": 1, "d": 1, "pct": 100, "display": "100%"}
    }
  ],
  "checkpoints": [
    {
      "afterSeq": 1,
      "expected": {
        "fold": {
          "match": {
            "status": "inProgress",
            "doubles": false,
            "winner": null,
            "provisional": false,
            "setsWon": {"A": 0, "B": 0},
            "scoreline": "0-0",
            "pointsPlayed": 1,
            "rallyLets": 0
          },
          "sets": [
            {"index": 0, "rule": "tiebreakSet", "games": {"A": 0, "B": 0}, "tiebreak": null, "winner": null, "complete": false, "byPenalty": false}
          ],
          "games": [
            {"index": 0, "set": 0, "gameInSet": 0, "kind": "standard", "server": "jon", "serverSide": "A", "winner": null, "points": {"A": 1, "B": 0}, "byPenalty": false, "complete": false, "break": false}
          ],
          "points": [
            {"id": "e001", "index": 0, "kind": "point", "determined": true, "afterMatchEnd": false, "set": 0, "game": 0, "gameInSet": 0, "tiebreak": null, "pointInGame": 1, "server": "jon", "receiver": "alex", "serverSide": "A", "courtSide": "deuce", "ends": {"A": "near", "B": "far"}, "before": {"sets": {"A": 0, "B": 0}, "games": {"A": 0, "B": 0}, "points": {"A": 0, "B": 0}}, "call": {"kind": "points", "server": "0", "receiver": "0"}, "pressure": {"gamePointFor": [], "breakPoint": false, "setPointFor": [], "matchPointFor": []}, "winner": "A", "endType": "ace", "serveNumber": 1, "strokeCount": 1, "rallyLength": 1, "provenance": "manual", "reviewState": "unreviewed", "after": {"gameWon": false, "setWon": false, "matchWon": false, "endChange": false, "rest": "point"}}
          ],
          "next": {
            "set": 0,
            "game": 0,
            "gameInSet": 0,
            "tiebreak": null,
            "pointInGame": 2,
            "server": "jon",
            "receiver": "alex",
            "serverSide": "A",
            "courtSide": "ad",
            "ends": {"A": "near", "B": "far"},
            "before": {"sets": {"A": 0, "B": 0}, "games": {"A": 0, "B": 0}, "points": {"A": 1, "B": 0}},
            "call": {"kind": "points", "server": "15", "receiver": "0"},
            "pressure": {"gamePointFor": [], "breakPoint": false, "setPointFor": [], "matchPointFor": []}
          },
          "checkpoints": [],
          "conflicts": [],
          "history": {"voided": [], "superseded": []},
          "changes": null
        },
        "stats": {
          "provisional": false,
          "countedPoints": 1,
          "excludedPoints": 0,
          "sides": {
            "A": {
              "totalPointsWon": {"n": 1, "d": 1, "pct": 100, "display": "100%"},
              "penaltyPointsAwarded": 0,
              "servicePoints": 1,
              "firstServeIn": {"n": 1, "d": 1, "pct": 100, "display": "100%"},
              "firstServePointsWon": {"n": 1, "d": 1, "pct": 100, "display": "100%"},
              "secondServePointsWon": {"n": 0, "d": 0, "pct": null, "display": "—"},
              "secondServeIn": {"n": 0, "d": 0, "pct": null, "display": "—"},
              "aces": 1,
              "doubleFaults": 0,
              "serviceWinners": 0,
              "servicePointsWon": {"n": 1, "d": 1, "pct": 100, "display": "100%"},
              "serviceGamesWon": {"n": 0, "d": 0, "pct": null, "display": "—"},
              "returnPointsWon": {"n": 0, "d": 0, "pct": null, "display": "—"},
              "returnFirstServePointsWon": {"n": 0, "d": 0, "pct": null, "display": "—"},
              "returnSecondServePointsWon": {"n": 0, "d": 0, "pct": null, "display": "—"},
              "returnGamesWon": {"n": 0, "d": 0, "pct": null, "display": "—"},
              "breakPointsSaved": {"n": 0, "d": 0, "pct": null, "display": "—"},
              "breakPointsConverted": {"n": 0, "d": 0, "pct": null, "display": "—"},
              "winners": 0,
              "forcedErrors": 0,
              "unforcedErrors": 0,
              "longestPointStreak": 1,
              "longestGameStreak": 0
            },
            "B": {
              "totalPointsWon": {"n": 0, "d": 1, "pct": 0, "display": "0%"},
              "penaltyPointsAwarded": 0,
              "servicePoints": 0,
              "firstServeIn": {"n": 0, "d": 0, "pct": null, "display": "—"},
              "firstServePointsWon": {"n": 0, "d": 0, "pct": null, "display": "—"},
              "secondServePointsWon": {"n": 0, "d": 0, "pct": null, "display": "—"},
              "secondServeIn": {"n": 0, "d": 0, "pct": null, "display": "—"},
              "aces": 0,
              "doubleFaults": 0,
              "serviceWinners": 0,
              "servicePointsWon": {"n": 0, "d": 0, "pct": null, "display": "—"},
              "serviceGamesWon": {"n": 0, "d": 0, "pct": null, "display": "—"},
              "returnPointsWon": {"n": 0, "d": 1, "pct": 0, "display": "0%"},
              "returnFirstServePointsWon": {"n": 0, "d": 1, "pct": 0, "display": "0%"},
              "returnSecondServePointsWon": {"n": 0, "d": 0, "pct": null, "display": "—"},
              "returnGamesWon": {"n": 0, "d": 0, "pct": null, "display": "—"},
              "breakPointsSaved": {"n": 0, "d": 0, "pct": null, "display": "—"},
              "breakPointsConverted": {"n": 0, "d": 0, "pct": null, "display": "—"},
              "winners": 0,
              "forcedErrors": 0,
              "unforcedErrors": 0,
              "longestPointStreak": 0,
              "longestGameStreak": 0
            }
          },
          "servers": {},
          "shots": {"total": 1, "pointsWithStrokeCount": 1},
          "rallyLength": {"0-4": 1, "5-8": 0, "9+": 0, "unknown": 0},
          "review": {
            "reviewed": 0,
            "needsReview": 0,
            "unreviewed": 1,
            "completion": {"n": 0, "d": 1, "pct": 0, "display": "0%"}
          },
          "durationMs": null,
          "momentum": {"window": 10, "side": "A", "series": [[1, 1]]}
        }
      }
    }
  ]
}
