{
  "schemaVersion": "1.0.0",
  "kind": "jovra.fixture.scoring",
  "id": "S34-game-penalty",
  "title": "Game penalty: opponent awarded the game; excluded from service-game counts",
  "covers": ["§3 USTA Table 14", "§6.1 service games exclude penalty games"],
  "input": {
    "format": {
      "presetId": "club_bo3",
      "setsToWin": 2,
      "gameScoring": "ad",
      "set": {"kind": "tiebreakSet", "games": 6, "tiebreakAt": 6, "tiebreak": {"points": 7}},
      "lets": "let"
    },
    "players": [
      {"id": "jon", "displayName": "Jon", "handedness": "right", "backhand": "twoHanded", "isSelf": true},
      {"id": "alex", "displayName": "Alex", "handedness": "left", "backhand": "oneHanded", "isSelf": false}
    ],
    "sides": {"A": ["jon"], "B": ["alex"]},
    "toss": {"firstServer": "jon", "startingEnds": {"A": "near", "B": "far"}},
    "log": [
      {"id": "e001", "seq": 1, "type": "point", "reviewed": {"winner": "A", "endType": "unknown", "provenance": "manual", "source": "user"}},
      {"id": "e002", "seq": 2, "type": "point", "reviewed": {"winner": "B", "endType": "unknown", "provenance": "manual", "source": "user"}},
      {"id": "e003", "seq": 3, "type": "penalty", "kind": "game", "player": "jon", "reason": "codeViolation"}
    ]
  },
  "assertions": [
    {"checkpoint": 0, "path": "fold.games[0].winner", "equals": "B"},
    {"checkpoint": 0, "path": "fold.games[0].byPenalty", "equals": true},
    {"checkpoint": 0, "path": "fold.games[0].break", "equals": false},
    {"checkpoint": 0, "path": "fold.games[0].points", "equals": {"A": 1, "B": 1}},
    {"checkpoint": 0, "path": "fold.sets[0].games", "equals": {"A": 0, "B": 1}},
    {"checkpoint": 0, "path": "fold.next.server", "equals": "alex"},
    {"checkpoint": 0, "path": "fold.next.ends", "equals": {"A": "far", "B": "near"}},
    {
      "checkpoint": 0,
      "path": "stats.sides.A.serviceGamesWon",
      "equals": {"n": 0, "d": 0, "pct": null, "display": "—"}
    },
    {
      "checkpoint": 0,
      "path": "stats.sides.B.returnGamesWon",
      "equals": {"n": 0, "d": 0, "pct": null, "display": "—"}
    }
  ],
  "checkpoints": [
    {
      "afterSeq": 3,
      "expected": {
        "fold": {
          "match": {
            "status": "inProgress",
            "doubles": false,
            "winner": null,
            "provisional": false,
            "setsWon": {"A": 0, "B": 0},
            "scoreline": "0-1",
            "pointsPlayed": 2,
            "rallyLets": 0
          },
          "sets": [
            {"index": 0, "rule": "tiebreakSet", "games": {"A": 0, "B": 1}, "tiebreak": null, "winner": null, "complete": false, "byPenalty": false}
          ],
          "games": [
            {"index": 0, "set": 0, "gameInSet": 0, "kind": "standard", "server": "jon", "serverSide": "A", "winner": "B", "points": {"A": 1, "B": 1}, "byPenalty": true, "complete": true, "break": false}
          ],
          "points": [
            {"id": "e001", "index": 0, "kind": "point", "determined": true, "afterMatchEnd": false, "set": 0, "game": 0, "gameInSet": 0, "tiebreak": null, "pointInGame": 1, "server": "jon", "receiver": "alex", "serverSide": "A", "courtSide": "deuce", "ends": {"A": "near", "B": "far"}, "before": {"sets": {"A": 0, "B": 0}, "games": {"A": 0, "B": 0}, "points": {"A": 0, "B": 0}}, "call": {"kind": "points", "server": "0", "receiver": "0"}, "pressure": {"gamePointFor": [], "breakPoint": false, "setPointFor": [], "matchPointFor": []}, "winner": "A", "endType": "unknown", "serveNumber": null, "strokeCount": null, "rallyLength": null, "provenance": "manual", "reviewState": "unreviewed", "after": {"gameWon": false, "setWon": false, "matchWon": false, "endChange": false, "rest": "point"}},
            {"id": "e002", "index": 1, "kind": "point", "determined": true, "afterMatchEnd": false, "set": 0, "game": 0, "gameInSet": 0, "tiebreak": null, "pointInGame": 2, "server": "jon", "receiver": "alex", "serverSide": "A", "courtSide": "ad", "ends": {"A": "near", "B": "far"}, "before": {"sets": {"A": 0, "B": 0}, "games": {"A": 0, "B": 0}, "points": {"A": 1, "B": 0}}, "call": {"kind": "points", "server": "15", "receiver": "0"}, "pressure": {"gamePointFor": [], "breakPoint": false, "setPointFor": [], "matchPointFor": []}, "winner": "B", "endType": "unknown", "serveNumber": null, "strokeCount": null, "rallyLength": null, "provenance": "manual", "reviewState": "unreviewed", "after": {"gameWon": false, "setWon": false, "matchWon": false, "endChange": false, "rest": "point"}}
          ],
          "next": {
            "set": 0,
            "game": 1,
            "gameInSet": 1,
            "tiebreak": null,
            "pointInGame": 1,
            "server": "alex",
            "receiver": "jon",
            "serverSide": "B",
            "courtSide": "deuce",
            "ends": {"A": "far", "B": "near"},
            "before": {"sets": {"A": 0, "B": 0}, "games": {"A": 0, "B": 1}, "points": {"A": 0, "B": 0}},
            "call": {"kind": "points", "server": "0", "receiver": "0"},
            "pressure": {"gamePointFor": [], "breakPoint": false, "setPointFor": [], "matchPointFor": []}
          },
          "checkpoints": [],
          "conflicts": [],
          "history": {"voided": [], "superseded": []},
          "changes": null
        },
        "stats": {
          "provisional": false,
          "countedPoints": 2,
          "excludedPoints": 0,
          "sides": {
            "A": {
              "totalPointsWon": {"n": 1, "d": 2, "pct": 50, "display": "50%"},
              "penaltyPointsAwarded": 0,
              "servicePoints": 2,
              "firstServeIn": {"n": 0, "d": 0, "pct": null, "display": "—"},
              "firstServePointsWon": {"n": 0, "d": 0, "pct": null, "display": "—"},
              "secondServePointsWon": {"n": 0, "d": 0, "pct": null, "display": "—"},
              "secondServeIn": {"n": 0, "d": 0, "pct": null, "display": "—"},
              "aces": 0,
              "doubleFaults": 0,
              "serviceWinners": 0,
              "servicePointsWon": {"n": 1, "d": 2, "pct": 50, "display": "50%"},
              "serviceGamesWon": {"n": 0, "d": 0, "pct": null, "display": "—"},
              "returnPointsWon": {"n": 0, "d": 0, "pct": null, "display": "—"},
              "returnFirstServePointsWon": {"n": 0, "d": 0, "pct": null, "display": "—"},
              "returnSecondServePointsWon": {"n": 0, "d": 0, "pct": null, "display": "—"},
              "returnGamesWon": {"n": 0, "d": 0, "pct": null, "display": "—"},
              "breakPointsSaved": {"n": 0, "d": 0, "pct": null, "display": "—"},
              "breakPointsConverted": {"n": 0, "d": 0, "pct": null, "display": "—"},
              "winners": 0,
              "forcedErrors": 0,
              "unforcedErrors": 0,
              "longestPointStreak": 1,
              "longestGameStreak": 0
            },
            "B": {
              "totalPointsWon": {"n": 1, "d": 2, "pct": 50, "display": "50%"},
              "penaltyPointsAwarded": 0,
              "servicePoints": 0,
              "firstServeIn": {"n": 0, "d": 0, "pct": null, "display": "—"},
              "firstServePointsWon": {"n": 0, "d": 0, "pct": null, "display": "—"},
              "secondServePointsWon": {"n": 0, "d": 0, "pct": null, "display": "—"},
              "secondServeIn": {"n": 0, "d": 0, "pct": null, "display": "—"},
              "aces": 0,
              "doubleFaults": 0,
              "serviceWinners": 0,
              "servicePointsWon": {"n": 0, "d": 0, "pct": null, "display": "—"},
              "serviceGamesWon": {"n": 0, "d": 0, "pct": null, "display": "—"},
              "returnPointsWon": {"n": 1, "d": 2, "pct": 50, "display": "50%"},
              "returnFirstServePointsWon": {"n": 0, "d": 0, "pct": null, "display": "—"},
              "returnSecondServePointsWon": {"n": 0, "d": 0, "pct": null, "display": "—"},
              "returnGamesWon": {"n": 0, "d": 0, "pct": null, "display": "—"},
              "breakPointsSaved": {"n": 0, "d": 0, "pct": null, "display": "—"},
              "breakPointsConverted": {"n": 0, "d": 0, "pct": null, "display": "—"},
              "winners": 0,
              "forcedErrors": 0,
              "unforcedErrors": 0,
              "longestPointStreak": 1,
              "longestGameStreak": 1
            }
          },
          "servers": {},
          "shots": {"total": 0, "pointsWithStrokeCount": 0},
          "rallyLength": {"0-4": 0, "5-8": 0, "9+": 0, "unknown": 2},
          "review": {
            "reviewed": 0,
            "needsReview": 0,
            "unreviewed": 2,
            "completion": {"n": 0, "d": 2, "pct": 0, "display": "0%"}
          },
          "durationMs": null,
          "momentum": {"window": 10, "side": "A", "series": [[1, 1], [1, 2]]}
        }
      }
    }
  ]
}
